"conversation_id_str","created_at","favorite_count","full_text","id_str","image_url","in_reply_to_screen_name","lang","location","quote_count","reply_count","retweet_count","tweet_url","user_id_str","username"
"1782410693632987399","Mon Apr 22 17:10:08 +0000 2024","92","@Catatan_ali7 Para orang kismin gembel kere hidup ndlap ndlup remahan2 rengginang...pilihan sudah ditetapkan jan berharap banyak dari pemerintahmu suaramu hanya seharga bansos yg diberikan dalam masa kampaye. Sekarang bertahan hiduplah dgn cara masing2 tak akan ada yg peduli&amp;membelamu.","1782456867933061242","","Catatan_ali7","in","","0","2","9","https://twitter.com/samber_ndelap/status/1782456867933061242","993844337971613697","samber_ndelap"
"1781542929443786892","Sat Apr 20 05:07:52 +0000 2024","61","@msaid_didu 497 trilyun aja gak jelas kemana duitnya jngn terkecoh sama kata2 pemabagian bansos kenyataannya para penerima yg cuma segelintir itu hanya mnerima 10kg psti sisa duitnya masih segunung","1781550327663415535","","msaid_didu","in","","0","2","2","https://twitter.com/put776/status/1781550327663415535","1570074569125535752","put776"
"1782592036799193404","Tue Apr 23 02:07:15 +0000 2024","51","MK Paman Usman Vs MK Suhartono Paman Usman tidak dilibatkan dalam menangani masalah PHPU karena Paman kena sanksi berat padahal tanpa melibatkan paman pun MK tetap akan menolak permohonan pemohon tanpa paman seolah-olah MK independen. _ Hallo Bansos Rp 497 T. https://t.co/SwxOUFgtJf","1782592036799193404","https://pbs.twimg.com/media/GL0KAsfbQAA7KQ9.jpg","","in","Indonesia","1","4","22","https://twitter.com/Jumianto_RK/status/1782592036799193404","903306838552092672","Jumianto_RK"
"1780861198797517015","Thu Apr 18 08:16:35 +0000 2024","85","@msaid_didu @jokowi @KemensosRI @DPR_RI kenapa ini tidak tersentuh oleh bansos yg nilainya ratusan triliyun kemiskinan yg tak terdatakah sampai ia kelaparan hingga meregang nyawa. Ingat mandat UUD 34 45 _fakir miskin &amp; anak2 yg terlantar dipelihara oleh negara apakah cuma sebagai pajangan.","1780873043784724535","","msaid_didu","in","Cari Se di Kaki Limo","0","4","17","https://twitter.com/sultan_ied/status/1780873043784724535","2148566490","sultan_ied"
"1782202305745752239","Mon Apr 22 00:18:36 +0000 2024","86","Sebijak apapun keputusan MK hari ini pasti tetap SALAH di mata yg kalah Dihina penerima bansos senyumin ajah Setia bersama @prabowo @gibran_tweet adalah sesuatu banget... Saatnya menghormati akhlak bukan uang Hebatnya Pemimpin RI 2024 https://t.co/MwDUSuuFMa","1782202305745752239","https://pbs.twimg.com/ext_tw_video_thumb/1782202259121766400/pu/img/2pXiSpHpf8n-ftq3.jpg","","in","","5","19","17","https://twitter.com/BANGSAygSUJUD/status/1782202305745752239","1189039138835554304","BANGSAygSUJUD"
"1780913725131882774","Thu Apr 18 12:33:29 +0000 2024","143","@DokterTifa Buk ada baiknya sblm sharing hal sensitif seperti ini ibuk pastikan dulu itu di daerah mana kepala daerahnya siapa dan siapa keluarga nya juga. Karna kalo semuanya tugas presiden yaa ga mungkin Bansos ga tepat sasaran jg karna ulah oknum yg ga bertanggung jawab. Bukan Jokowi","1780937697009533066","","DokterTifa","in","Sumatera Barat, Indonesia ","0","17","2","https://twitter.com/Gudermann51/status/1780937697009533066","944984033464692737","Gudermann51"
"1780799269689258007","Thu Apr 18 05:47:30 +0000 2024","0","@Chavesz08 Para bazer bansos kepanasan kyknya","1780835527971020992","","Chavesz08","in","","0","0","0","https://twitter.com/KoiYosep/status/1780835527971020992","1451570679409639425","KoiYosep"
"1782398620777722013","Mon Apr 22 13:18:41 +0000 2024","8","Beda Pendapat Hakim Saldi Isra Bahas Penyalahgunaan Bansos dan Aparat Tak Netral https://t.co/sEOYX1VNnn","1782398620777722013","","","in","Indonesia","3","0","1","https://twitter.com/KompasTV/status/1782398620777722013","71436318","KompasTV"
"1781114245654130992","Fri Apr 19 01:26:23 +0000 2024","38","@msaid_didu @Wong_Loman 92 juta suara sebagiannya didapatkan karena sebab utak-Atik kewenangan Penguasa menggunakan dana Bansos Menyebar Plt memakai Buzzerp dan transaksi hitam yang mulai terungkap: jelas2 kelalaian dan ketidakcakapan Pemerintah sampai dana publik ratusan-ribuan Trillion dikorupsi.","1781132202870509896","","msaid_didu","in","Indonesia","0","5","9","https://twitter.com/perangutan23/status/1781132202870509896","1017066291218116609","perangutan23"
"1780943368627028134","Thu Apr 18 12:56:02 +0000 2024","58","Jawaban Sri Mulyani menurut ekonom Anthony Budiawan tdk sesuai fakta APBN &amp; dapat dianggap bohong. Perpres 76/2023 tdk ada agrn Bansos di Kemen. Koor.Perekonomian Kementerian Koordinator Bidang PMK Kemen.Perdagangan srta Lembaga Badan Pangan Nasional https://t.co/EffCUjUdNC","1780943368627028134","","","in","Jakarta Pusat, DKI Jakarta","1","1","37","https://twitter.com/RikeSants/status/1780943368627028134","1389046349895663616","RikeSants"
"1781220223141728517","Fri Apr 19 08:53:55 +0000 2024","17","@T0M5helby 1 6 T itu kalkulator kamu coba pake kalkulator sirekap atau pejuang bansos Pasti 1600 T. Kamu paham nggak.? Makanya belajar sama ketua KPU.","1781244828405379087","","T0M5helby","in","","0","2","0","https://twitter.com/sudirmanto_iman/status/1781244828405379087","758140333989388288","sudirmanto_iman"
"1781532529738252499","Sat Apr 20 03:57:09 +0000 2024","66","Mantan Ketua MK Prof Hamdan Zoelva: Bansos program negara utk rakyat miskin masalahnya adalah penyalurannya ada embel embel gambar 02 warna bungkusannya titipan dgn nama ini dari Jokowi. TSM beneeerr. -- IPK 3 5 Australia di Petrokimia Gresik Kominfo Arisan Sarapan https://t.co/umfVFMy6xD","1781532529738252499","https://pbs.twimg.com/ext_tw_video_thumb/1781532394073546752/pu/img/Ayn1HGqP7nKUg6lB.jpg","","in","","1","4","17","https://twitter.com/sharpandshark/status/1781532529738252499","1628338800362672128","sharpandshark"
"1782986605843853313","Wed Apr 24 04:15:07 +0000 2024","1","MK Tolak Dalil permohonan amin soal kaitan bansos dengan peningkatan suara 02 #Pemilu2024AmanDamai https://t.co/5yaE2YPcOs","1782986605843853313","https://pbs.twimg.com/media/GL5wvm2asAA8wEk.jpg","","in","Kota Jambi, Jambi","0","0","0","https://twitter.com/kharism79/status/1782986605843853313","1564436564855234560","kharism79"
"1782947340460110146","Wed Apr 24 01:39:06 +0000 2024","0","#demokrasimati berdampak ekonomi terpuruk @mprgoid @DPR_RI @DPDRI @officialMKRI: 1. Utang semakin besar beban generasi semakin berat 2. Impor semakin besar merusak fundamental berdikari 3. Bansos semakin besar bentuk mental pengemis 4. Investasi asing bolehkan penjajahan ekonomi","1782947340460110146","","","in","Indonesia","0","1","0","https://twitter.com/JagaReformasi/status/1782947340460110146","1632932257576132608","JagaReformasi"
"1782287742761926878","Mon Apr 22 05:58:05 +0000 2024","152","Ditolak semua nya sama Mahkamah Konstitusi ? Gimana rasanya Gibran didiskualifikasi eh ditolak MK Gibran gak sah juga ditolak MK Presiden Jokowi ikutan cawe cawe ditolak MK Hubungannya sama bansos ditolak MK Presiden dibilang naikin gaji &amp; tunjangan karena Pilpres ditolak","1782287742761926878","","","in","💕","3","35","23","https://twitter.com/NyaiiBubu/status/1782287742761926878","1219890224936783874","NyaiiBubu"
"1781686542412452132","Sat Apr 20 14:09:08 +0000 2024","1","there was this one time in mexico that i had to shit sooooo bad y no habían baños and my sisters just made fun of me the whole hour :( https://t.co/a6wT0dQM4T","1781686542412452132","https://pbs.twimg.com/ext_tw_video_thumb/1781686465593823232/pu/img/WD-aWtcJ6ZcfqN78.jpg","","en","","0","0","0","https://twitter.com/jeceykha/status/1781686542412452132","1861522423","jeceykha"
"1782315674431607168","Mon Apr 22 07:49:05 +0000 2024","16","HAPPENING NOW: The League of Filipino Students - UPLB together with Bagong Alyansang Makabayan Timog Katagalugan is currently postering and mass distributing flyers around Los Baños to condemn the first day of Balikatan Exercises in the Philippines. https://t.co/n71YNWdYrP","1782315674431607168","https://pbs.twimg.com/media/GLwOnQjboAAWuLb.jpg","","en","Republic of the Philippines","0","1","6","https://twitter.com/elepsuplb/status/1782315674431607168","706087110424420353","elepsuplb"
"1780642012481405328","Wed Apr 17 16:58:33 +0000 2024","4102","Resulta que hoy un señor con peluca y gabardina ha robado en un banco en Bilbao luego se ha dado a la fuga secuestrando un coche a punta de pistola y ha entrado en los baños de un hospital a cambiarse de ropa y de momento no le han encontrado He leído novelas menos entretenidas.","1780642012481405328","","","es","","22","16","292","https://twitter.com/RocioMDP/status/1780642012481405328","243669613","RocioMDP"
"1781276570314736070","Fri Apr 19 11:00:03 +0000 2024","1311","The #UPLB campus is in #bloom! https://t.co/WGSOM4Detw","1781276570314736070","https://pbs.twimg.com/media/GLhRi0VbIAA3i1z.jpg","","en","Los Baños, Laguna","137","1","287","https://twitter.com/UPLBOfficial/status/1781276570314736070","713894180","UPLBOfficial"
"1781747307207094521","Sat Apr 20 18:10:35 +0000 2024","17","Pleasure to have you lads ","1781747307207094521","","","en","Trebanos RFC","0","0","2","https://twitter.com/BanosOldBoys/status/1781747307207094521","1651143155935240192","BanosOldBoys"
"1779949097291542845","Mon Apr 15 19:05:09 +0000 2024","19","Hoy en la historia: Bombardeo de los aeropuertos de San Antonio de los Baños Ciudad Libertad y Santiago de Cuba.🇨🇺 #GirónVictorioso #IzquierdaPinera https://t.co/hqouNWfMmw","1779949097291542845","https://pbs.twimg.com/media/GLOmKMmXMAAJzm-.jpg","","es","","1","0","22","https://twitter.com/Lisigarciap/status/1779949097291542845","1460362332333391877","Lisigarciap"
"1779921718498210106","Mon Apr 15 17:16:21 +0000 2024","1248","#MemoriaHistórica:15 de abril de 1961 aviones camuflados con insignias de la Fuerza Aérea Revolucionaria atacaron el aeropuerto de Ciudad Libertad la base aérea de San Antonio de los Baños y el aeródromo de la oriental ciudad de Santiago de Cuba #DíaDeLaDefensaAntiaérea #CubaVive https://t.co/OqtHYsNCr5","1779921718498210106","https://pbs.twimg.com/media/GLONW9iXEAA9jER.jpg","","es","Cuba","33","14","1554","https://twitter.com/InesMChapman/status/1779921718498210106","1065706186480263168","InesMChapman"
"1782483840621031729","Mon Apr 22 18:57:19 +0000 2024","112","Alguien cerca de estos baños para que vayamos a pasarla rico? https://t.co/g6GrpWpMrw","1782483840621031729","https://pbs.twimg.com/media/GLynms_X0AA2bV7.jpg","","es","Puebla, México","0","13","17","https://twitter.com/CheliGon18502/status/1782483840621031729","1645602081586159621","CheliGon18502"
"1780790167764127812","Thu Apr 18 02:47:16 +0000 2024","18","To formally launch the #Drones4Rice project in the Philippines DA-PhilRice and IRRI held an inception workshop on 16-17 April for farmers and other stakeholders at the IRRI Headquarters in Los Baños Laguna. https://t.co/3n6LnVNcAJ","1780790167764127812","https://pbs.twimg.com/media/GLajJXBW8AAGP6i.jpg","","en","International","0","0","5","https://twitter.com/irri/status/1780790167764127812","92654013","irri"
"1782806577172324828","Tue Apr 23 16:19:45 +0000 2024","265","Baños destruidos y colectivos en UBA exactas https://t.co/Uz8fJe0dCH","1782806577172324828","https://pbs.twimg.com/ext_tw_video_thumb/1782806251463639040/pu/img/oJm_sxmogw7dEs96.jpg","","es"," Buenos aires, Recoleta","3","8","99","https://twitter.com/Tomidiazcueto/status/1782806577172324828","821018759104253954","Tomidiazcueto"
"1782749685096345885","Tue Apr 23 12:33:41 +0000 2024","1","Who is Mark Hamill ????","1782749685096345885","","","en","USA","0","0","1","https://twitter.com/BanosDad1/status/1782749685096345885","4580206353","BanosDad1"
"1780301386674024809","Tue Apr 16 18:25:01 +0000 2024","46","Propuestas transitorias para la mejora de #ElArcángel: En el interior: - Limpieza profunda y a presión de asientos/baños - Colocación de lona en el foso de Tribuna - Asientos blancos en Tribuna - 2º Marcador en Fondo Norte En el exterior: - Mejora de los accesos - Lona exterior https://t.co/pF5vMRiQJB","1780301386674024809","https://pbs.twimg.com/media/GLTiv0eW8AIXD9w.jpg","","es","Córdoba, España","2","3","5","https://twitter.com/juanmanevado_/status/1780301386674024809","1536132259","juanmanevado_"
"1782612146846658940","Tue Apr 23 05:29:33 +0000 2024","38","@aldogeotv No buscaran a un peruano🇵🇪🇵🇪 vtuber esquizo para el evento de chill [me conocen por detonar baños] https://t.co/UiKWiOqufA","1782642948028481695","https://pbs.twimg.com/tweet_video_thumb/GL04BAcWEAAm3F8.jpg","aldogeotv","es","Pueblo Marrón","2","37","13","https://twitter.com/Soukyp_/status/1782642948028481695","892904929752436740","Soukyp_"
"1781893254323278290","Sun Apr 21 03:50:32 +0000 2024","41","Oof. This is tough to text but after years of praying for an opportunity to be closer to my son I truly believe God has opened a door to make that happen. I will be leaving CW after 9 years and moving back to Los Banos where I have been blessed the opportunity to become","1781893254323278290","","","en","","2","9","0","https://twitter.com/CoachTrent_Tay/status/1781893254323278290","1529952047994245120","CoachTrent_Tay"
"1780204915723247846","Tue Apr 16 12:01:41 +0000 2024","405","🇨🇺El preludio de Girón fueron los ataques aéreos a las pistas de aviación de Ciudad Libertad San Antonio de los Baños y Santiago de Cuba hechos que cobraron la vida de valerosos jóvenes el 15 de abril anterior. https://t.co/8ELTPpIVnD","1780204915723247846","","","es","Cuba","8","6","539","https://twitter.com/cubadebatecu/status/1780204915723247846","1179768099442171910","cubadebatecu"
"1780039255487553713","Tue Apr 16 01:03:24 +0000 2024","24","#TenemosMemoria Bombardeo de los aeropuertos de San Antonio de los Baños Ciudad Libertad y Santiago de Cuba #GirónVictorioso #IzquierdaPinera https://t.co/73EN2fzlVp","1780039255487553713","https://pbs.twimg.com/media/GLP4RMAX0AAZahD.jpg","","es","","0","1","24","https://twitter.com/marticalopezna1/status/1780039255487553713","1480649718199947266","marticalopezna1"
"1780759650083750002","Thu Apr 18 00:46:00 +0000 2024","380","Sabes que los van a regalar para agrandar los baños cuando los pibes se ven así https://t.co/7h9cHK7k3a","1780759650083750002","https://pbs.twimg.com/media/GLaHdrCXMAAPudA.jpg","","es","","1","0","28","https://twitter.com/Juanpeveintidos/status/1780759650083750002","1601360591909801990","Juanpeveintidos"
"1782424162138530197","Mon Apr 22 15:00:10 +0000 2024","244","🇪🇸 | El Coronel Pedro Baños y el analista Juan Antonio De Castro sitúan a Soros tras el movimiento independentista catalán y señalan al PP y al PSOE como cómplices. De Castro: «Le entregamos a los comisarios el cuadro de las interrelaciones que demuestran que es la OSC de Soros https://t.co/hGd3ud2pHM","1782424162138530197","https://pbs.twimg.com/amplify_video_thumb/1782424019616010241/img/pmTTX2DAKozxXuQL.jpg","","es","España","7","2","131","https://twitter.com/herqles_es/status/1782424162138530197","1336091302593769473","herqles_es"
"1779987738256703694","Mon Apr 15 21:38:42 +0000 2024","8","El 15 de abril de 1961 durante los bombardeos a los aeropuertos de San Antonio de los Baños Ciudad Libertad y Santiago de Cuba cae en combate Eduardo García Delgado joven artillero que escribió con su sangre antes de morir el nombre de Fidel #GirónVictorioso https://t.co/lq5PZRjd1E","1779987738256703694","https://pbs.twimg.com/media/GLPJZPQWMAAmIFw.jpg","","es","Sancti Spíritus, Cuba ","0","0","9","https://twitter.com/Maykel22377643/status/1779987738256703694","1349898041449472007","Maykel22377643"
"1780045125005000905","Tue Apr 16 01:26:44 +0000 2024","10","Bombardeo a los aeropuertos de San Antonio de los Baños Ciudad Libertad y Santiago de Cuba #GirónVictorioso #CubaViveEnSuHistoria https://t.co/aft86sc3On","1780045125005000905","https://pbs.twimg.com/media/GLP9anGXAAAeOKL.jpg","","es","","0","0","10","https://twitter.com/DireccionGuane/status/1780045125005000905","1397191043297198083","DireccionGuane"
"1782977717400686889","Wed Apr 24 03:39:48 +0000 2024","1","MK tolak dalil permohonan Amin soal kaitan bansos #MK https://t.co/Q8dyjDvFY5","1782977717400686889","https://pbs.twimg.com/media/GL5oxZlaUAA6lfF.jpg","","in","Central Borneo, Indonesia","0","0","0","https://twitter.com/suara_netizen_/status/1782977717400686889","1567432793147449346","suara_netizen_"
"1781069447463362888","Thu Apr 18 23:25:02 +0000 2024","0","@zeinnawawyreal Thruster swap?","1781101662024905017","","zeinnawawyreal","en","","0","0","0","https://twitter.com/Sedaprasanyaad/status/1781101662024905017","1664537980026114048","Sedaprasanyaad"
"1780799269689258007","Fri Apr 19 04:26:57 +0000 2024","0","@Chavesz08 hahaha...bansos..ngarep makan gratis","1781177641380540888","","Chavesz08","tl","","0","0","0","https://twitter.com/SyahrulCha34259/status/1781177641380540888","1713766391890010112","SyahrulCha34259"
"1782421718520455396","Mon Apr 22 20:19:17 +0000 2024","58","@Nicho_Silalahi Katanya Soeharto kkn tapi kok bisa hidup makmur rakyatnya kala itu ini sih over kkn tapi rakyatnya ga sadar bahkan terlena oleh pesona bansos blt dll yang cuma bikin perut nyaman sehari menderita perlima 5 tahun","1782504470099919069","","Nicho_Silalahi","in","","0","13","5","https://twitter.com/buer40880/status/1782504470099919069","1684076095501660160","buer40880"
"1782714574959157325","Tue Apr 23 10:14:10 +0000 2024","5","APBN mestinya untuk semua rakyat. Bukan untuk dicuri Jokowi untuk pemenangan Gibran bin Jokowi. Bansos dibagikan ke rakyat dengan label bantuan presiden lalu pejabat2 memberitahu ke rakyat itu pemberian Pak presiden #DinastiGarongAPBN #DinastiGarongAPBN https://t.co/rpMizJCNoM","1782714574959157325","https://pbs.twimg.com/media/GL15c_mbYAAT8-U.jpg","","in","","0","0","5","https://twitter.com/dancersejati07/status/1782714574959157325","1605747132014637061","dancersejati07"
"1780032797979423163","Tue Apr 16 00:37:45 +0000 2024","0","Bansos Star Rail Kikir Impact https://t.co/bcSizqoFAs","1780032797979423163","https://pbs.twimg.com/media/GLPyZVVbcAAOAVg.jpg","","in","","0","2","0","https://twitter.com/catsoekey/status/1780032797979423163","1286705399001800704","catsoekey"
"1781231918962626628","Fri Apr 19 08:02:37 +0000 2024","13","TELANJANG DI DEPAN UMUM semua orang melihatnya menyaksikannya kenapa masih belum MALU JUGA. dulu mengatakan lawannya menggunakan BANSOS DALAM PEMENANGANNYA kini bilang KEJAM. https://t.co/I2AQiogLHG","1781231918962626628","https://pbs.twimg.com/media/GLg0_JhaMAAbkoG.jpg","","in","","1","2","5","https://twitter.com/zainalmusyaffak/status/1781231918962626628","1714177289871925248","zainalmusyaffak"
"1780828371003506813","Thu Apr 18 09:08:56 +0000 2024","10","@xquitavee Mayan lah buat beli beras bansos https://t.co/tP4U9N4Iwi","1780886218848505900","https://pbs.twimg.com/media/GLb6kh0agAAblx7.jpg","xquitavee","in","","0","4","0","https://twitter.com/Ifundvm04/status/1780886218848505900","1544247029202751489","Ifundvm04"
"1780617257229660646","Wed Apr 17 15:20:11 +0000 2024","0","Aku udh seneng bjir dpt bansos harian https://t.co/Uwci8nAXck","1780617257229660646","https://pbs.twimg.com/media/GLYF9WjaEAAjoRS.jpg","","in","","0","1","0","https://twitter.com/Ohiyaoks_/status/1780617257229660646","1393629779727847426","Ohiyaoks_"
"1780397057473499577","Wed Apr 17 00:45:11 +0000 2024","1","Tidak Ada Politisi Bansos https://t.co/AeAiZkDF2x","1780397057473499577","https://pbs.twimg.com/media/GLU9rx6agAA7UtR.jpg","","in","Palu Barat, Sulawesi Tenngah","1","0","0","https://twitter.com/Wulanda94104964/status/1780397057473499577","1413402709227577349","Wulanda94104964"
"1780937430004277505","Thu Apr 18 12:32:26 +0000 2024","24","Karena rakyat Indonesia masih banyak yang super bodoh diberi bansos udah sepeti anjing dikasih makan majikanya contohnya bajer beras Mukidi https://t.co/ZenaCjurkO","1780937430004277505","https://pbs.twimg.com/media/GLcpJ3cbQAARU0T.jpg","","in","Indonesia","0","2","5","https://twitter.com/Bang_San77/status/1780937430004277505","1170847237779255296","Bang_San77"
"1780079350047797340","Tue Apr 16 14:13:28 +0000 2024","314","@ErikkuRii Gini nih kalau kemiskinan struktural cuman dikasih solusi pake bansos. Gak bakal hilang selanjutnya jadi mengarah ke tindakan kriminal. ","1780238082484355532","","ErikkuRii","in","Semarang, Jawa Tengah","3","10","44","https://twitter.com/bebebnya_Roseee/status/1780238082484355532","1070974980563730432","bebebnya_Roseee"
"1780812093815763068","Thu Apr 18 10:30:33 +0000 2024","2","@Fahrihamzah Karena milih duit&amp;bansos https://t.co/uvbBShn9St","1780906760431419643","https://pbs.twimg.com/ext_tw_video_thumb/1780906711781662720/pu/img/LRlKhuFwL5rwkas8.jpg","Fahrihamzah","in","","0","0","2","https://twitter.com/ABjodohComeback/status/1780906760431419643","1717201992567939072","ABjodohComeback"
"1780095290613145804","Tue Apr 16 04:46:04 +0000 2024","50","Mohon diramaikan sampai setiap mahasiswa kampus hukum berikut dosen-dosennya baca bahwa ada pelanggaran Penganggaran pada Bansos di masa pemilu lalu terima kasih","1780095290613145804","","","in","","1","1","29","https://twitter.com/blank0429/status/1780095290613145804","2908675710","blank0429"
"1781146184377315788","Fri Apr 19 02:52:41 +0000 2024","31","@alisyarief 96 jt goib hasil penggelembungan + bansos","1781153921186287742","","alisyarief","in","","0","0","4","https://twitter.com/e_soebroto/status/1781153921186287742","75544203","e_soebroto"
"1780546663087735111","Wed Apr 17 10:39:40 +0000 2024","57","Jingkrak jingkrak dgn narasi yg kasih bansos sama blt siapaaa? Eeeehhh dari uang rakyat APBN. Kasian ngaku ngaku ternyata Booong uang rakyat -- Tag; Gaji 100jt The Heirs Dubai Mr. Queen Qatar Suka Kris Ujan Kurama Netanyahu United https://t.co/H63N32bD1t","1780546663087735111","https://pbs.twimg.com/ext_tw_video_thumb/1780546606104010752/pu/img/ZQ_HsGWyZGGzU0s_.jpg","","in","","1","13","33","https://twitter.com/sharpandshark/status/1780546663087735111","1628338800362672128","sharpandshark"
"1781259015303139521","Fri Apr 19 11:10:40 +0000 2024","20","@vanc1Bozz Giliran bansos paling didepan giliran umumkan BBM naik cuci tangan kasi org lain... wkwkwkwk Payah kau @jokowi wkwkwkwk https://t.co/i7EelNlPmh","1781279242648760696","https://pbs.twimg.com/ext_tw_video_thumb/1781279217998794752/pu/img/q-lKAkBcU-YtlF7k.jpg","vanc1Bozz","in","","2","1","5","https://twitter.com/Allunk1801/status/1781279242648760696","1552890439128137728","Allunk1801"
"1779719530635530672","Wed Apr 17 13:37:13 +0000 2024","0","@shwonuayo I want my bansos","1780591346275041641","","shwonuayo","en","selfol","0","0","0","https://twitter.com/JKAEMlN/status/1780591346275041641","1707338910379233280","JKAEMlN"
"1780481607406846135","Wed Apr 17 06:21:09 +0000 2024","116","Menyala bang @AliNgabalinNew Program Bansos Presiden @jokowi emx udh jadi UU di APBN dan sudah di lakukan dri dulu2 sblm copras capres ko mlah di bilang politisasi bansos oleh kubu lobet https://t.co/PaLcGH2AI5","1780481607406846135","https://pbs.twimg.com/ext_tw_video_thumb/1780481547382210560/pu/img/QF1kK2KlobaH5TV2.jpg","","in","Hokota-shi, Ibaraki","4","38","22","https://twitter.com/xquitavee/status/1780481607406846135","1604408934525464576","xquitavee"
"1781343857093054808","Fri Apr 19 15:27:25 +0000 2024","11","Di sini juga ada Yg aneh juga loh.. Kalah telak terus nyalahin bansos.. Aneh kan https://t.co/NbdZdaTuxp","1781343857093054808","","","in","","0","6","2","https://twitter.com/BBerizik/status/1781343857093054808","1336498517028716546","BBerizik"
"1780932441861173261","Thu Apr 18 12:12:36 +0000 2024","40","Besok pendukung Prabowo Gibran akan DEMO di PATUNG KUDA. Semua pendukung 02 unjuk rasa krn selama ini di hina &amp; difitnah dgn Bansos DLL. Sy &amp; semua org blm pernah melihat bansos kyk gmn. Ingat besok demo. Kita gak terima 02 di anulir krn difitnah. RT yg banyak teman !","1780932441861173261","","","in","","1","9","17","https://twitter.com/Ki_Nusantara99/status/1780932441861173261","1707418170871717888","Ki_Nusantara99"
"1780189604064489698","Tue Apr 16 11:00:50 +0000 2024","0","aku tanpa bansos (Redeem Code) dari Bluepoch https://t.co/BXAeHQoV1n","1780189604064489698","https://pbs.twimg.com/media/GLSBAtubsAAbEAs.jpg","","in","","0","0","0","https://twitter.com/Dellvyne_J/status/1780189604064489698","1758738251198984193","Dellvyne_J"
"1780853044642820276","Thu Apr 18 06:57:07 +0000 2024","0","Off honkai dulu sampe bansos cause i need to recover from gepard tragedy ️","1780853044642820276","","","en",":p","0","0","0","https://twitter.com/voyawger/status/1780853044642820276","1410812952060436481","voyawger"
"1780628083470709219","Thu Apr 18 00:50:30 +0000 2024","16","@dewiirawan13 Kenapa ga di demo ya DPR nya krn ga segera mensahkan UU PERAMPASAN ASET KORUPTOR malah nyalahin bansos (duit ops presiden) 271 T tanyain DPR dong shg bisa mensejahterakan rakyat oleh UU Perampasan aset koruptor","1780760782994862590","","dewiirawan13","in","","0","5","3","https://twitter.com/AjaNizwar/status/1780760782994862590","1464535975309320192","AjaNizwar"
"1780794805502804203","Thu Apr 18 03:05:41 +0000 2024","19","https://t.co/QxwuCvar9d Miris dan sangat menyedihkan! PASCA LEBARAN 2024 SEORANG IBU MUDA BERNAMA SURYATI TEWAS KELAPARAN! Fakta ini sangat menyedihkan karena terjadi ketika baru saja menyeruak berita Bansos Rp. 496 Triliun diduga digunakan untuk kampanye paslon tertentu.","1780794805502804203","","","in","Pulau Punjung, Indonesia","2","7","21","https://twitter.com/AndiPitopang7/status/1780794805502804203","1557398948825903104","AndiPitopang7"
"1779985148219359501","Mon Apr 15 21:28:24 +0000 2024","25","toda la razón los baños de fadu https://t.co/GGIFkkKZvN","1779985148219359501","https://pbs.twimg.com/media/GLPHDvxWIAAd1vr.jpg","","es","que miras ","0","0","6","https://twitter.com/mgalvarezzz/status/1779985148219359501","1406983091130974213","mgalvarezzz"
